{
  "required" : true ,
  "$schema" : "http://json-schema.org/draft-03/schema" ,
  "type" : "object" ,
  "properties" : {
    "folders" : {
      "type" : "array" ,
      "required" : false ,
      "items" : [
        {
          "type" : "object" ,
          "properties" : {
            "id" : {
              "type" : "number" ,
              "required" : false
            } ,
            "name" : {
              "type" : "string" ,
              "required" : false
            }
          }
        }
      ]
    } ,
    "sheets" : {
      "type" : "array" ,
      "required" : false ,
      "items" : [
        {
          "type" : "object" ,
          "properties" : {
            "accessLevel" : {
              "type" : "string" ,
              "required" : false
            } ,
            "id" : {
              "type" : "number" ,
              "required" : false
            } ,
            "name" : {
              "type" : "string" ,
              "required" : false
            }
          }
        }
      ]
    } ,
    "templates" : {
      "type" : "array" ,
      "required" : false ,
      "items" : [
      ]
    } ,
    "workspaces" : {
      "type" : "array" ,
      "required" : false ,
      "items" : [
      ]
    }
  }
}